{
  "$schema": "https://json-schema.org/draft/2020-12/schema",
  "$id": "urn:oaw:literature:literature-search:input:1",
  "title": "literature-search input",
  "type": "object",
  "properties": {
    "question": {
      "type": "string",
      "minLength": 1
    },
    "scope_id": {
      "type": [
        "string",
        "null"
      ]
    },
    "scope_revision": {
      "type": [
        "integer",
        "null"
      ],
      "minimum": 0
    },
    "request_id": {
      "type": "string",
      "minLength": 1
    },
    "available_capabilities": {
      "type": "array",
      "items": {
        "type": "string",
        "minLength": 1
      }
    },
    "query_terms": {
      "type": "array",
      "items": {
        "type": "string",
        "minLength": 1
      }
    },
    "seed_paper_ids": {
      "type": "array",
      "items": {
        "type": "string",
        "minLength": 1
      }
    },
    "max_queries": {
      "type": "integer",
      "minimum": 1,
      "maximum": 100
    },
    "inclusion_criteria": {
      "type": "array",
      "items": {
        "type": "string",
        "minLength": 1
      }
    },
    "exclusion_criteria": {
      "type": "array",
      "items": {
        "type": "string",
        "minLength": 1
      }
    }
  },
  "required": [
    "question",
    "scope_id",
    "scope_revision",
    "request_id",
    "available_capabilities",
    "query_terms",
    "seed_paper_ids",
    "max_queries",
    "inclusion_criteria",
    "exclusion_criteria"
  ],
  "additionalProperties": false,
  "$defs": {
    "source": {
      "type": "object",
      "properties": {
        "source_id": {
          "type": "string",
          "minLength": 1
        },
        "kind": {
          "enum": [
            "paper",
            "abstract",
            "document",
            "search",
            "code",
            "data",
            "user",
            "agent_inference"
          ]
        },
        "locator": {
          "type": "string",
          "minLength": 1
        },
        "access": {
          "enum": [
            "metadata",
            "abstract",
            "fulltext",
            "si_code",
            "user_input",
            "not_read"
          ]
        }
      },
      "required": [
        "source_id",
        "kind",
        "locator",
        "access"
      ],
      "additionalProperties": false
    }
  }
}
